{
  "$schema": "http://json-schema.org/draft-07/schema#",
  "title": "Subtask",
  "type": "object",
  "required": ["subtask_id", "task_id", "action", "expected_output", "verification_method", "completion_evidence"],
  "properties": {
    "subtask_id": { "type": "string" },
    "task_id": { "type": "string" },
    "action": { "type": "string" },
    "expected_output": { "type": "string" },
    "verification_method": { "type": "string" },
    "completion_evidence": { "type": "string" }
  }
}
